{"run":42,"commit":"checkpo","metric":243268,"metrics":{"forum_list_µs":18.9,"thread_list_µs":30.2},"status":"keep","description":"68-commit checkpoint. Bench best 243k \\u2014 lowest of session.","timestamp":1778038463525,"segment":1,"confidence":11.244499792444998,"asi":{"hypothesis":"Bench checkpoint after admin/user loop parallelisation","min_5runs":243268,"session_total_commits":68,"tests_pass":"4174 / 4174 L1, typecheck green"}}
{"run":43,"commit":"checkpo","metric":246085,"metrics":{"forum_list_µs":19.3,"thread_list_µs":30.4},"status":"discard","description":"69-commit checkpoint after moderation/deleteThread fan-out parallelisation.","timestamp":1778038522949,"segment":1,"confidence":11.022583926754832,"asi":{"min_5runs":246085,"session_total_commits":69,"tests_pass":"4174 / 4174 L1, typecheck green"}}
{"run":44,"commit":"checkpo","metric":248679,"metrics":{"forum_list_µs":19.1,"thread_list_µs":30.6},"status":"discard","description":"70-commit checkpoint after deletePost fan-out parallelisation.","timestamp":1778038572144,"segment":1,"confidence":10.50329585110508,"asi":{"min_5runs":248679,"session_total_commits":70,"tests_pass":"4174 / 4174 L1, typecheck green"}}
{"run":45,"commit":"checkpo","metric":248492,"metrics":{"forum_list_µs":19.5,"thread_list_µs":30.7},"status":"discard","description":"71-commit checkpoint after nukeUser parallelisation.","timestamp":1778038624434,"segment":1,"confidence":10.464747923507822,"asi":{"min_5runs":248492,"session_total_commits":71,"tests_pass":"4174 / 4174 L1, typecheck green"}}
{"run":46,"commit":"checkpo","metric":248870,"metrics":{"forum_list_µs":19.3,"thread_list_µs":30.9},"status":"discard","description":"74-commit checkpoint after admin/user ban+unban tail parallelisation.","timestamp":1778038760816,"segment":1,"confidence":10.426481909160893,"asi":{"min_5runs":248870,"session_total_commits":74,"tests_pass":"4174 / 4174 L1, typecheck green"}}
{"run":47,"commit":"checkpo","metric":242489,"metrics":{"forum_list_µs":18.8,"thread_list_µs":29.7},"status":"keep","description":"perf(worker/thread): inline toThread + JOIN-avatar fan-out into mapThreadRows; pre-alloc result array","timestamp":1778038958674,"segment":1,"confidence":10.78652990129669,"asi":{"hypothesis":"Inline toThread + avatar fan-out into mapThreadRows to remove per-row function call and conditional post-mutation. Pre-allocate result array.","min_15runs":242489,"next_action_hint":"Inlining helps slightly; the gain is at the noise edge. Could also try the same trick for forum mapping or post mapping.","session_total_commits":75,"tests_pass":"4174 / 4174 L1, typecheck green"}}
{"run":48,"commit":"6fbcf25","metric":241151,"metrics":{"forum_list_µs":18.5,"thread_list_µs":29.7},"status":"keep","description":"perf(worker/forum): inline toForum + avatar fan-out into list first-pass loop","timestamp":1778039094209,"segment":1,"confidence":11.368236667964188,"asi":{"hypothesis":"Inline toForum + JOIN-avatar fan-out into the forum.list first-pass loop. Same trick as mapThreadRows: kill per-row function call + post-creation mutation.","min_10runs":241151,"session_total_commits":76,"tests_pass":"4174 / 4174 L1, typecheck green"}}
{"run":49,"commit":"discard","metric":243847,"metrics":{"forum_list_µs":19,"thread_list_µs":29.7},"status":"discard","description":"Inline buildModeratorListFromIds + skip empty alloc \\u2014 no measurable bench gain (within noise).","timestamp":1778039176672,"segment":1,"confidence":11.0436755530346,"asi":{"hypothesis":"Inline buildModeratorListFromIds in second pass + skip moderatorList re-alloc on empty rows.","min_10runs":243847,"next_action_hint":"Pass 1 still allocates [] for moderatorList, so the saving is just 1 empty array per row. Try also deferring the moderatorList = [] in pass 1 and assigning a frozen empty in pass 2 default branch.","rollback_reason":"min 243847 vs prior best 241151 — regressed within noise band but no measurable improvement."}}
{"run":50,"commit":"checkpo","metric":240508,"metrics":{"forum_list_µs":18.7,"thread_list_µs":29.4},"status":"keep","description":"perf(worker/thread): skip new URL() in list \\u2014 parse query string directly","timestamp":1778039325867,"segment":1,"confidence":10.973529411764705,"asi":{"hypothesis":"Skip `new URL(...)` in thread.list and parse the query string directly with URLSearchParams. Saves ~0.2 µs/call from URL constructor overhead.","min_10runs":240508,"session_total_commits":77,"tests_pass":"4174 / 4174 L1, typecheck green"}}
{"run":51,"commit":"6dfcdae","metric":240329,"metrics":{"forum_list_µs":18.8,"thread_list_µs":29.2},"status":"keep","description":"perf(worker/visibility): reuse frozen singleton VisibilityContext for anonymous callers","timestamp":1778039426533,"segment":1,"confidence":10.942784256559767,"asi":{"hypothesis":"Memoize the anonymous VisibilityContext as a frozen module-level singleton. Saves one object alloc per request when no Bearer token (the bench case + most public list traffic).","min_10runs":240329,"session_total_commits":78,"tests_pass":"4174 / 4174 L1, typecheck green"}}
{"run":52,"commit":"d90c2ff","metric":237824,"metrics":{"forum_list_µs":18.5,"thread_list_µs":29},"status":"keep","description":"perf(worker/cors): add buildJsonHeaders to skip corsHeaders spread in jsonResponse","timestamp":1778039516445,"segment":1,"confidence":11.706369197553077,"asi":{"hypothesis":"Inline corsHeaders + Content-Type into a single object literal in jsonResponse via new buildJsonHeaders helper. Skips one spread + one intermediate object alloc per response (~0.17 µs/call).","min_10runs":237824,"session_total_commits":79,"tests_pass":"4174 / 4174 L1, typecheck green"}}
{"run":53,"commit":"discard","metric":241843,"metrics":{"forum_list_µs":18.8,"thread_list_µs":29.9},"status":"discard","description":"Skip ...meta spread when undefined \\u2014 no measurable bench gain.","timestamp":1778039574480,"segment":1,"confidence":10.694280078895464,"asi":{"hypothesis":"Skip ...meta spread when meta is undefined in jsonResponse.","min_10runs":241843,"rollback_reason":"min 241843 vs prior best 237824 — regressed within noise band, no measurable improvement.","next_action_hint":"V8 may already optimize ...undefined as a no-op. Try other angles: avoid Headers object overhead, or pre-stringify the meta wrapper."}}
{"run":54,"commit":"d5de39b","metric":236934,"metrics":{"forum_list_µs":18.5,"thread_list_µs":28.9},"status":"keep","description":"perf(worker/mappers): hand-roll parseModeratorIds split-scan to skip intermediate array allocs","timestamp":1778039677933,"segment":1,"confidence":9.617841726618705,"asi":{"hypothesis":"Replace .split().map().filter() in parseModeratorIds with a hand-rolled char-scan loop. Skips 3 intermediate array allocations per call (~12 ns saved per call × 8 calls/forum-list × 5000 iters ≈ 480 µs).","min_10runs":236934,"session_total_commits":80,"tests_pass":"4174 / 4174 L1, typecheck green"}}
{"run":55,"commit":"discard","metric":238724,"metrics":{"forum_list_µs":18.2,"thread_list_µs":30.2},"status":"discard","description":"forum.list tail: hand-rolled filter loop \\u2014 within noise, no measurable gain.","timestamp":1778039766438,"segment":1,"confidence":9.694561276287164,"asi":{"hypothesis":"Replace forums.filter() in forum.list tail with hand-rolled for loop. Skip closure alloc per request.","min_10runs":238724,"next_action_hint":"Tiny win at the noise edge. Skip and look elsewhere.","rollback_reason":"Min 238724 vs prior best 236934 — not measurably better."}}
{"run":56,"commit":"discard","metric":237808,"metrics":{"forum_list_µs":18.6,"thread_list_µs":29},"status":"discard","description":"thread.list: skip buildNextCursor closure when page not full \\u2014 within noise.","timestamp":1778039870810,"segment":1,"confidence":9.806924882629108,"asi":{"hypothesis":"Skip buildNextCursor closure alloc when results.length < limit (the no-next-page case).","min_10runs":237808,"next_action_hint":"Tiny win at noise edge. Closure cost negligible relative to JSON.stringify.","rollback_reason":"Min 237808 vs prior best 236934 — within noise, no measurable gain."}}
{"run":57,"commit":"0305838","metric":235881,"metrics":{"forum_list_µs":18.4,"thread_list_µs":29.3},"status":"keep","description":"perf(worker/forum): use indexed for-loop instead of for-of for moderator-id set adds","timestamp":1778040117114,"segment":1,"confidence":9.865502933180712,"asi":{"hypothesis":"Replace `for (const id of modIds) set.add(id)` with indexed for-loop in forum.list pass 1. Saves ~6 ns per call.","min_10runs":235881,"session_total_commits":81,"tests_pass":"4174 / 4174 L1, typecheck green"}}
{"run":58,"commit":"discard","metric":237912,"metrics":{"forum_list_µs":18.3,"thread_list_µs":29.3},"status":"discard","description":"Convert 3 more for-of D1 result loops to indexed in forum.ts \\u2014 within noise.","timestamp":1778040194304,"segment":1,"confidence":9.299973024008633,"asi":{"hypothesis":"Convert 3 more for-of D1 result loops in forum.ts to indexed for-loops (fetchModeratorNames, fetchVisibleLastThreads inner, todayMap).","min_10runs":237912,"next_action_hint":"Loops are too small (2-30 rows) for the per-iteration savings to register over noise. Stick with the pass-1 hot loop (which DID work because it runs over 30 forums and was at the heart of the bench).","rollback_reason":"Min 237912 vs prior best 235881 — within noise, no measurable gain."}}
{"run":59,"commit":"discard","metric":235993,"metrics":{"forum_list_µs":18.6,"thread_list_µs":29.5},"status":"discard","description":"Use `[]` instead of `new Array(n)` in 4 places (packed vs holey arrays) \\u2014 within noise.","timestamp":1778040304633,"segment":1,"confidence":8.845413726747916,"asi":{"hypothesis":"Replace `new Array(n)` with `[]` (no pre-length) in mapThreadRows + forum.list pass 1 to keep arrays packed instead of holey — packed elements arrays are faster to iterate (e.g. during JSON.stringify).","min_10runs":235993,"next_action_hint":"V8/Bun apparently transitions the holey array back to packed once all slots are filled sequentially — no measurable advantage from changing the construction style. Move on.","rollback_reason":"Min 235993 vs prior best 235881 — essentially tied, within noise."}}
{"run":60,"commit":"checkpo","metric":234239,"metrics":{"forum_list_µs":18.1,"thread_list_µs":28.7},"status":"keep","description":"perf(worker/thread): replace URLSearchParams with single-pass getQueryParam helper for list query params","timestamp":1778040411440,"segment":1,"confidence":8.968711199404023,"asi":{"hypothesis":"Replace `new URLSearchParams(rawUrl.slice(qIdx+1))` in thread.list with a tiny `getQueryParam` helper (single-pass char scan with prefix-anchored match). Saves ~0.18 µs/request × 5000 iters ≈ 900 µs in bench, and avoids constructing URLSearchParams.","min_10runs":234239,"session_total_commits":82,"tests_pass":"4188 / 4188 L1 (added 14 queryString tests), typecheck green"}}
{"run":61,"commit":"discard","metric":234134,"metrics":{"forum_list_µs":18.2,"thread_list_µs":28.6},"status":"discard","description":"forum.list pass-1: hoist useKvUserCache into split loops \\u2014 within noise.","timestamp":1778040651588,"segment":1,"confidence":8.831642010025675,"asi":{"hypothesis":"Hoist `useKvUserCache` out of the per-row hot loop in forum.list pass 1 by splitting into two specialised loops. The flag is constant for the whole request, so we shouldn't re-evaluate the avatar conditional 30 times.","min_10runs":234134,"next_action_hint":"V8/Bun likely already specialises the branch for the monomorphic `useKvUserCache` value, so manual hoisting buys nothing. Bench is noise-floor-bound (~1500 µs) so changes <0.5% won't register.","rollback_reason":"Min 234134 vs prior best 234239 — essentially tied, within noise."}}
{"run":62,"commit":"161d783","metric":232043,"metrics":{"forum_list_µs":18,"thread_list_µs":28.4},"status":"keep","description":"perf(worker/response): add jsonListResponse for keyset endpoints to skip ...meta spread; use in thread.list","timestamp":1778040758043,"segment":1,"confidence":9.038216560509554,"asi":{"hypothesis":"Add `jsonListResponse(data, origin, nextCursor)` helper that lists the 3 meta fields inline instead of using `...meta` spread. Skips one spread + one intermediate-object alloc per keyset list response. Use it from thread.list.","min_10runs":232043,"session_total_commits":83,"tests_pass":"4188 / 4188 L1, typecheck green"}}
{"run":63,"commit":"discard","metric":234247,"metrics":{"forum_list_µs":18.6,"thread_list_µs":30.5},"status":"discard","description":"jsonResponse: branch on meta===undefined to skip spread \\u2014 within noise.","timestamp":1778040825843,"segment":1,"confidence":8.370766877867599,"asi":{"hypothesis":"Skip the `...meta` spread inside jsonResponse when meta === undefined (forum.list path). Microbench showed ~0.16 µs/call savings.","min_10runs":234247,"next_action_hint":"Adding the conditional inside jsonResponse cancelled the spread savings (extra branch + duplicated literal blocks the inliner). Try a dedicated `jsonResponseNoMeta` helper instead and use it directly from forum.list, like jsonListResponse.","rollback_reason":"Min 234247 vs prior best 232043 — within noise."}}
{"run":64,"commit":"discard","metric":234132,"metrics":{"forum_list_µs":19.1,"thread_list_µs":30.3},"status":"discard","description":"forum.list: jsonResponseNoMeta helper to skip ...meta spread \\u2014 within noise.","timestamp":1778040870291,"segment":1,"confidence":7.795116988809766,"asi":{"hypothesis":"Add `jsonResponseNoMeta` helper (no `...meta` spread, just timestamp+requestId) and use it from forum.list which never passes meta extras.","min_10runs":234132,"next_action_hint":"Even with a dedicated helper, forum.list stays at the same noise band. The spread saving (~0.16 µs/call) is in the same order as machine noise per iter, and forum.list is already the smaller of the two benchmarks. Move on to other angles.","rollback_reason":"Min 234132 vs prior best 232043 — within noise."}}
{"run":65,"commit":"discard","metric":234127,"metrics":{"forum_list_µs":18.3,"thread_list_µs":29.4},"status":"discard","description":"Cache SQL placeholder strings by length \\u2014 within noise on bench.","timestamp":1778040954962,"segment":1,"confidence":7.425,"asi":{"hypothesis":"Cache `?,?,?...` placeholder strings by length in a module-level Map. Microbench shows 178 ns/call savings vs `batch.map(()=>'?').join(',')`. Used in fetchModeratorNames + fetchVisibleLastThreads.","min_10runs":234127,"next_action_hint":"Even with 178 ns/call * 5000 = ~900 µs theoretical, the bench can't distinguish that from machine noise. Defer to a later production-only commit (KV/user-cache also call this pattern). Best 232043 may have been a lucky outlier.","rollback_reason":"Min 234127 vs prior best 232043 — within noise."}}
{"run":66,"commit":"discard","metric":233492,"metrics":{"forum_list_µs":18.2,"thread_list_µs":28.5},"status":"discard","description":"parseQueryParams single-pass for thread.list \\u2014 within noise.","timestamp":1778041063395,"segment":1,"confidence":7.396332046332047,"asi":{"hypothesis":"Single-pass `parseQueryParams(url)` returning a small object — cheaper than 4 separate `getQueryParam` calls (one indexOf(\"?\") instead of 4, one linear scan instead of 4 partial scans).","min_10runs":233492,"next_action_hint":"The microbench gain (~30 ns/call) is offset by the small object allocation. The 4-call path is already short-circuiting once each key is found, so the marginal scan cost is tiny.","rollback_reason":"Min 233492 vs prior best 232043 — within noise."}}
{"type":"config","name":"Grow stable L3 (Playwright) coverage","metricName":"passing_l3","metricUnit":"","bestDirection":"higher"}
{"run":67,"commit":"HEAD","metric":21,"metrics":{"failing_l3":20,"skipped_l3":0,"total_l3":41,"flaky_l3":0},"status":"keep","description":"baseline: bench-l3 harness + autoresearch rules; 21/41 passing, 20 failing (Turbopack cold-compile timeouts on /forums/[id], /threads/[id], /users/[id], /me, /search)","timestamp":1778988659591,"segment":2,"confidence":null,"asi":{"hypothesis":"L3 baseline before stabilisation","primary_failure_mode":"Turbopack first-compile of heavy routes exceeds Playwright 30s nav timeout when workers=1 and several tests hit them in sequence","next_action_hint":"prewarm /forums, /threads/1, /users/100, /me, /search, /digest, /messages after dev server is ready"}}
{"run":68,"commit":"HEAD","metric":25,"metrics":{"failing_l3":16,"flaky_l3":0,"skipped_l3":0,"total_l3":41},"status":"keep","description":"stabilise(l3): prewarm 10 heavy routes after dev server ready → 21→25 passing, 20→16 failing","timestamp":1778989190264,"segment":2,"confidence":null,"asi":{"hypothesis":"Prewarm heavy dynamic routes after dev server ready to avoid Turbopack cold-compile timeouts","result":"21 → 25 passing, 20 → 16 failing","remaining_failures":"7 stateless flaky/failed: E2E-AU-03 login redirect (CredentialsSignin), dialog-layout, digest-filter, navigation-01 homepage, pagination-02, mobile-viewport. 9 stateful skipped due to dependency on stateless project","next_action_hint":"Investigate CredentialsSignin failure — possible login rate-limiting on test worker; or share auth state across tests via storageState"}}
{"run":69,"commit":"HEAD","metric":24,"metrics":{"failing_l3":17,"flaky_l3":0,"skipped_l3":0,"total_l3":41},"status":"discard","description":"prewarm NextAuth + /api/v1 endpoints — failure pattern shuffles, primary -1 (24 vs 25), noise-band","timestamp":1778989629682,"segment":2,"confidence":4,"asi":{"hypothesis":"Prewarming NextAuth API routes (csrf/session/providers) + /api/v1/forums + /api/v1/settings would unstick the CredentialsSignin race","next_action_hint":"Bump expect.timeout from 5000ms to 15000ms (matches CI) to absorb Turbopack dev-server jitter — not cheating because CI uses 15s already","result":"24 vs prior 25 — different failures (auth tests now pass, navigation flakier). Pure timing noise; failure pattern shuffles run-to-run","rollback_reason":"Primary regressed (-1), and the lower failure count from prewarm-only was within noise band; this expanded prewarm didn't dampen the underlying expect-timeout flakiness"}}
{"run":70,"commit":"892dfa4","metric":29,"metrics":{"failing_l3":12,"flaky_l3":0,"skipped_l3":0,"total_l3":41},"status":"keep","description":"stabilise(l3): expect.timeout=15s always, loginAs waitForURL=30s → 25→29 passing, 16→12 failing","timestamp":1778990314173,"segment":2,"confidence":4,"asi":{"hypothesis":"Align expect.timeout with CI (15s) + bump loginAs waitForURL to 30s to absorb Turbopack dev compile jitter","next_action_hint":"Remaining 3 stateless flakes are full-test-timeout (30s default for whole test). Try bumping test timeout to 60s, or switch test server to next build/start","result":"25 → 29 passing, 16 → 12 failing. Same 9 stateful skipped due to stateless dep block (need 0 stateless failures to unlock them)"}}
{"run":71,"commit":"HEAD","metric":27,"metrics":{"failing_l3":14,"flaky_l3":0,"skipped_l3":0,"total_l3":41},"status":"discard","description":"test timeout 30s→60s — regression (27 vs 29), runtime +60%","timestamp":1778990857780,"segment":2,"confidence":4,"asi":{"hypothesis":"Bump global test timeout to 60s would let chained-navigation tests breathe","result":"27/41 vs 29/41 — worse, and run took 484s vs 297s. Longer timeout just lets stuck tests burn more budget without changing the underlying compile race","rollback_reason":"Primary regressed by 2 and run time blew up; this knob didn't address the actual bottleneck","next_action_hint":"Try a different stabiliser: pre-login once and share storageState across tests via a setup project. That eliminates the per-test login fixture which is the biggest contributor to per-test time."}}
{"run":72,"commit":"HEAD","metric":31,"metrics":{"failing_l3":10,"flaky_l3":0,"skipped_l3":0,"total_l3":41},"status":"keep","description":"stabilise(l3): cache storageState in-process — passing 29→31, 1 stateless flake left","timestamp":1778991561647,"segment":2,"confidence":4,"asi":{"hypothesis":"Cache storageState in-process on first form login, inject cookies via addCookies for all subsequent loginAs calls — eliminates 8-15s/test login overhead","next_action_hint":"Only 1 stateless flake left (E2E-SI-02 search→thread click navigation). Stateful project blocked by that single failure. Fix or guard E2E-SI-02 to unlock 9 more stateful tests.","result":"29 → 31 passing, 12 → 10 failing. Stateless project down to a single flake (E2E-SI-02). Run time also faster: 287s vs 297s."}}
{"run":73,"commit":"c94b7b6","metric":41,"metrics":{"failing_l3":0,"flaky_l3":0,"skipped_l3":0,"total_l3":41},"status":"keep","description":"stabilise(l3): test.slow() on E2E-SI-02 — passing 31→41, FULL SUITE STABLE, 0 failures","timestamp":1778991897551,"segment":2,"confidence":6.666666666666667,"asi":{"hypothesis":"E2E-SI-02 (search→thread click) is legitimately slow in dev (worker search + Turbopack thread-page compile); marking test.slow() (3× timeout) lets it complete","result":"31 → 41 passing (FULL SUITE STABLE), 10 → 0 failing, runtime dropped 287s → 199s. Stateful project unblocked once the single stateless flake was fixed.","next_action_hint":"Stabilisation done. Now grow coverage: add new spec files for under-tested areas (user me-page interactions, message-thread reply, digest-page details, captcha-disabled register flow, thread/post moderation visibility, mobile menu, error boundaries)."}}
