{"run":74,"commit":"a5b262b","metric":41,"metrics":{"failing_l3":0,"flaky_l3":0,"skipped_l3":0,"total_l3":41},"status":"keep","description":"stabilise(l3): networkidle→load in page objects + content waits in message/thread; 41/41 in 155s","timestamp":1778993513233,"segment":2,"confidence":5.714285714285714,"asi":{"hypothesis":"Replace `waitForLoadState(\"networkidle\")` (flaky due to HMR websockets) with `\"load\"` in page objects, and add content-shape waits in message/thread page objects to bridge the post-`load` data fetch gap","next_action_hint":"Confirm stability with multiple runs. If stable, start adding new spec coverage: 404 routes, logout flow, theme persistence, header user menu, redirect-back, footer links.","result":"Two consecutive 41/41 runs (155s, 165s). Down from 199-297s before. Much faster because we stopped waiting 30s on networkidle that never fires."}}
{"run":75,"commit":"HEAD","metric":45,"metrics":{"failing_l3":0,"flaky_l3":0,"skipped_l3":0,"total_l3":45},"status":"keep","description":"coverage(l3): +4 E2E-NF tests for not-found / invalid-id routes — 41→45 passing","timestamp":1778993824251,"segment":2,"confidence":4.8,"asi":{"hypothesis":"Add 4 stateless tests for not-found / invalid-id routes (/threads/99999999, /threads/non-numeric, /users/99999999, /forums/non-numeric) — all hit known error-card render paths","result":"41 → 45 passing, 0 failing. All 4 new tests pass first try.","next_action_hint":"Continue adding stateless coverage: logout flow, theme persistence, redirect-back after login, mobile menu toggle, footer presence."}}
{"run":76,"commit":"HEAD","metric":48,"metrics":{"failing_l3":0,"flaky_l3":0,"skipped_l3":0,"total_l3":48},"status":"checks_failed","description":"coverage(l3): +3 E2E-UA tests — passed bench (48/48) but biome format check failed; will retry","timestamp":1778994136557,"segment":2,"confidence":3.2,"asi":{"hypothesis":"+3 stateless tests for theme persistence, logout flow, and login redirect-back","next_action_hint":"Add more stateless coverage: header user menu, mobile menu/hamburger, search empty-state, anchor links from breadcrumb. Also consider adding stateful E2E-TC for moving threads.","result":"45 → 48 passing, 0 failing. Initial run had a biome format issue — fixed and re-running.","rollback_reason":"checks_failed (biome format on new spec). Will retry after formatting."}}
{"run":77,"commit":"bbfb043","metric":48,"metrics":{"failing_l3":0,"flaky_l3":0,"skipped_l3":0,"total_l3":48},"status":"keep","description":"coverage(l3): +3 E2E-UA tests for theme persist, logout, login redirect-back; 45→48","timestamp":1778994447789,"segment":2,"confidence":2.7,"asi":{"hypothesis":"Re-attempt: +3 stateless tests for theme persistence, logout flow, and login redirect-back — this time pre-formatted with biome","next_action_hint":"Continue adding stateless coverage: search empty-state with rare query, ipv4-restricted page, /me email-verification banner state, header navigation links. Then maybe a stateful test for thread move/delete confirmation.","result":"45 → 48 passing, 0 failing. All 3 new tests pass, checks now clean."}}
{"run":78,"commit":"HEAD","metric":39,"metrics":{"failing_l3":13,"flaky_l3":0,"skipped_l3":0,"total_l3":52},"status":"discard","description":"coverage(l3) attempt: +4 E2E-NX tests + flake fixes. Severe run variance 51/40/39 — discard","timestamp":1778995641474,"segment":2,"confidence":3,"asi":{"hypothesis":"Run 2 of navigation-extra/test.slow UJ-03/networkidle-fix TC-02. Confirms big run-to-run variance: 51 → 40 → 39 across 3 consecutive runs","next_action_hint":"The base suite has ~10–20 test variance on a Turbopack dev server. To make the bench reliable enough for further coverage growth, switch the test server to `next build && next start` (production mode — deterministic, fast). Add ideas to autoresearch.ideas.md and pursue this next.","result":"39/52 — worse than the 48/48 baseline. Same code as the 51 run earlier. Pure variance. The 4 new tests aren't the cause.","rollback_reason":"Primary regressed by 9 vs running best, with 13 failures (3 pre-existing flakes per spec, plus 9 stateful skipped due to dep block). Discarding lets us re-attempt with a stabiliser (production-mode test server) first."}}
{"run":79,"commit":"HEAD","metric":0,"metrics":{"failing_l3":0,"flaky_l3":0,"skipped_l3":0,"total_l3":48},"status":"discard","description":"probe: bun run build:forum succeeds","timestamp":1778995689266,"segment":2,"confidence":3,"asi":{"hypothesis":"Probe: bun run build:forum works","result":"8.7s (cache hit). Prod mode viable."}}
{"run":80,"commit":"HEAD","metric":37,"metrics":{"failing_l3":11,"flaky_l3":0,"skipped_l3":0,"total_l3":48},"status":"discard","description":"probe: prod-mode test server — 37/48, no improvement; reverting to dev mode","timestamp":1778996042953,"segment":2,"confidence":3.375,"asi":{"hypothesis":"Switching test server to `next build && next start` (prod mode) would eliminate Turbopack dev-server variance","next_action_hint":"Prod mode isn't a silver bullet — still 11 failures with different failure pattern. The variance seems inherent to the test workload (cross-network calls to the worker, browser concurrency). Try adding retries=1 + better prewarm next.","result":"37/48 in prod mode — worse than dev's 48/48 best. Different failure pattern: E2E-DL-01 newThread button missing, E2E-UA-02 logout flow not redirecting. Prod-mode introduces its own subtle differences (e.g. missing dev error banner, different SSR caching).","rollback_reason":"Prod mode didn't deliver stability; produced its own new failures."}}
{"run":81,"commit":"031808e","metric":48,"metrics":{"failing_l3":0,"flaky_l3":4,"skipped_l3":0,"total_l3":48},"status":"keep","description":"stabilise(l3): enable retries=1 locally; 48/48 stable (4 flaky-retried)","timestamp":1778996537329,"segment":2,"confidence":2.8421052631578947,"asi":{"hypothesis":"After the networkidle→content-wait fix in page objects, retries=1 should now actually help: most flakes are individual jitters that pass on second try (rather than the deterministic networkidle-never-fires pattern from before)","next_action_hint":"Now that retries absorb individual flakes, expand coverage again. Re-attempt navigation-extra.spec.ts; also add empty-state for search, /me email banner content, header search box on /threads/[id].","result":"48/48 stable. 4 tests needed a retry (flaky_l3=4) but all eventually passed. Runtime: 444s (vs ~200s without retries) — a ~50% bench-time tax for full stability."}}
{"run":82,"commit":"fc35e82","metric":52,"metrics":{"failing_l3":0,"flaky_l3":0,"skipped_l3":0,"total_l3":52},"status":"keep","description":"coverage(l3): +4 E2E-NX navigation tests; 48→52, 0 flaky","timestamp":1778996900854,"segment":2,"confidence":3.4444444444444446,"asi":{"hypothesis":"Re-attempt navigation-extra.spec.ts now that retries=1 absorbs the jitter that caused 51→40→39 variance earlier","next_action_hint":"Keep adding tests in small batches. Next: search empty-state, header navigation links on threads page, /me account section content.","result":"52/52 in 292s, 0 flaky retries. All 4 new E2E-NX tests pass cleanly."}}
{"run":83,"commit":"HEAD","metric":35,"metrics":{"failing_l3":21,"flaky_l3":3,"skipped_l3":0,"total_l3":56},"status":"discard","description":"probe: +4 E2E-MX tests blocked by test-worker network timeout — retry","timestamp":1778998115435,"segment":2,"confidence":3.263157894736842,"asi":{"hypothesis":"+4 E2E-MX misc-coverage tests (search empty, /me sections, logo click, /digest content)","next_action_hint":"Wait for network to recover and retry. Don't keep this run — the failure is environmental, not test logic.","result":"35/56 — massive cascade. Root cause: ConnectTimeoutError to ellie-test.nocoo.workers.dev:443 throughout the run. Local dev server hit 10s timeouts on every worker call → every page returned partial content → every test failed.","rollback_reason":"Transient network failure to remote test worker. Will retry; no test-logic issue suspected."}}
{"run":84,"commit":"dca0c14","metric":56,"metrics":{"failing_l3":0,"flaky_l3":2,"skipped_l3":0,"total_l3":56},"status":"keep","description":"coverage(l3): +4 E2E-MX misc tests; 52→56","timestamp":1778998761269,"segment":2,"confidence":3.888888888888889,"asi":{"hypothesis":"Re-attempt E2E-MX (4 tests) once test-worker network recovered","next_action_hint":"Keep adding stateless tests in small batches. Next ideas: header navbar link clicks (/, /digest, /search, /messages), /me account section interactions, /forums grouping for ForumType.Group, dialog-layout for additional dialogs.","result":"56/56 passing. 2 flaky retries. All 4 new tests pass. Runtime 550s (network was slow this run, plus 2 retries)."}}
{"run":85,"commit":"d686af0","metric":58,"metrics":{"failing_l3":0,"flaky_l3":1,"skipped_l3":0,"total_l3":58},"status":"keep","description":"coverage(l3): +2 E2E-AL already-logged-in card button tests; 56→58","timestamp":1778999264681,"segment":2,"confidence":4.352941176470588,"asi":{"hypothesis":"+2 E2E-AL tests for already-logged-in card buttons (前往首页 / 切换账号)","next_action_hint":"Add more value: header navbar link clicks (digest, messages), email-not-verified flow tests, post-comment thread, attachment download links if seeded.","result":"56 → 58 passing, 1 flaky retry, runtime 404s."}}
{"run":86,"commit":"616fed6","metric":62,"metrics":{"failing_l3":0,"flaky_l3":1,"skipped_l3":0,"total_l3":62},"status":"keep","description":"coverage(l3): +4 E2E-HA header/footer action tests; 58→62","timestamp":1778999849566,"segment":2,"confidence":4.1,"asi":{"hypothesis":"+4 E2E-HA tests for header/footer action elements (精华帖 link, message icon, footer copyright, new-thread dialog open)","next_action_hint":"Continue: thread page action buttons (reply, report), digest level tabs (extending E2E-DF beyond just visibility), forum group page rendering, email-verified state on /me. Maybe also a stateful test for E2E-MS-03 sending a real message to self.","result":"58 → 62 passing, 0 failures, 1 flaky retry. Runtime 472s."}}
